232,8408852,"What so many out there do not realize is the importance of what you do after you work out. You may have done the majority of the work, but how you treat your body in the minutes and hours after you exercise has a direct effect on muscle soreness, muscle strength and growth, and staying hydrated. Cool Down. After your last exercise, your workout is not over. The first thing you need to do is cool down. Even if running was all that you did, you still should do light cardio for a few minutes. This brings your heart rate down at a slow and steady pace, which helps you avoid feeling sick after a workout."
233,8408877,"How Many Ounces Can a Letter Weigh Before There's a Need to Add Another Stamp? The cost of a first-class stamp is $0.49, according to the United States Postal Service website as of November 2017. One needs a single stamp to mail a letter that weighs one ounce or less. Each additional ounce carries with it a cost of $0.21. This is the cost for mailing when stamps are purchased at the post office. There can be other additional charges as well, depending on the shape and size of the letter. Cost of Postage Through Metered Mail There is a slight discount for metered mail. The cost to mail a one-ounce letter through metered mail is $0.46, with a charge of $0.21 per additional ounce. Metered mail is mail that is sent by businesses, and it includes self-addressed stamped envelopes."
234,8409454,"There are three major types of skin cancers: basal cell carcinoma (BCC), squamous cell carcinoma (SCC), and melanoma. The first two skin cancers are grouped together as non-melanoma skin cancers. Other unusual types of skin cancer include Merkel cell tumors and dermatofibrosarcoma protruberans. Here are the basics on skin cancers: 1  The vast majority of skin cancers are basal cell carcinomas and squamous cells carcinomas. 2  While malignant, these are unlikely to spread to other parts of the body."
235,8409649,"Washington Township, NJ Real Estate & Homes For Sale. 1  58 Hillcrest Ave, Washington Township, NJ 07882. 2  51 Hillcrest Ave., Washington Township, NJ 07882. 3  163 Jackson Valley Rd, Washington Township, NJ 07882.  180 Belvidere Ave, Washington Township, NJ 1  07882. 78 Washington Square Cir, Washington Township, NJ 07882."
236,8409732,"First, the exclusion from the definition of a Part D drug for drugs covered under Parts A or B is based on whether coverage is available under Part A or Part B for the drug as it is being “prescribed and dispensed or administered” with respect to the individual."
237,8410344,"film Full Cast of Switched At Birth Actors/Actresses. Switched at Birth cast list, listed alphabetically with photos when available. This list of Switched at Birth actors includes any Switched at Birth actresses and all other actors from the film. You can view additional information about each Switched at Birth actor on this list, such as when and where they were born."
238,8410592,"Average funeral costs in the West Midlands for 2011 are £2100 for a cremation including a Hearse and coffin and all professional fees including Crematoria, doctors and minister. Extras such as a limousine should cost approx £160."
239,8410595,Return string with the first letters of each word capitalized (self.javascript) submitted 1 year ago by tiepkhac012. I'm a littlE tEa poT should be ==> I'm A Little Tea Pot. but the result is the same as oringinal I'm a littlE tEa poT.
240,8410714,"Children do die of vaccine-preventable diseases. However, many vaccinated children acquire the very diseases against which they are vaccinated. But many millions also suffer and die later in life due to the diseases vaccine induce by dysregulating the immune system."
241,8410788,Foods Good for Liver. The liver is used to break down substances and help to filter out toxins that are harmful to your body. Adjusting your diet to get more foods that are good for the liver can promote both good liver health and overall improved body function.
242,8410944,"example, if you’re eligible for a $500 spouses, widows, or widowers benefit from Social. Security, you’ll get $100 a month from Social. Security ($500 – $400 = $100). If two-thirds of. your government pension is more than your. Social Security benefit, your benefit could be. reduced to zero. If you take your government pension annuity in. a lump sum, Social Security will calculate the. reduction as if you chose to get monthly benefit. payments from your government work."
243,841100,"In that case, a stop-loss order immediately turns into a market order and will be sold around the $12.50 price. A stop-limit order at $15 in such a scenario would not be exercised, since the stock falls from $20 to $12.50 without touching $15. That's why a stop loss offers greater protection for fast-moving stocks."
244,8411052,"The SELECT DISTINCT statement is used to return only distinct (different) values. In a table, a column may contain many duplicate values; and sometimes you only want to list the different (distinct) values.he SELECT DISTINCT statement is used to return only distinct (different) values. In a table, a column may contain many duplicate values; and sometimes you only want to list the different (distinct) values."
245,8411207,"Indianola, Illinois. Indianola is a village in Carroll Township, Vermilion County, Illinois, United States. It is part of the Danville, Illinois Metropolitan Statistical Area. The population was 207 at the 2000 census."
246,8411304,"Second Row Quad Seats-How to use car chairs and rear seats on 2017 Chrysler Pacifica Hybrid - Duration: 1:21. Mopar 4,041 views"
247,8411362,"The benefit for new frames is every two years ($10 copay; $75 towards frame; plus $20 for certain brands; plus 20% off anything over the allowance). I have three pairs of glasses – regular prescription glasses, prescription sunglasses, and prescription glasses to wear when I’m on the computer."
248,7143366,"i think you mean hydrochlorothiazide. maybe the name you gave is another generic. however, i use the name i gave in 50ng daily. it's used as a diuretic, and also to control high blood pressure by removing excess fluids in the body. the more serious side effects include low blood sugar or high blood sugar or a sensitivity to the drug."
249,8411976,I have changed a few of the taxiways and parking positions according to how they are in real life.I have also made an apron and taxiways to the Canterbury Aero Club like in real life.(the Canterbury Aero Club is the buidlings and apron directly across the main runway fro mthe main international airport terminal).
250,7143527,Draco The name Draco is a baby boy name. Meaning Latin Meaning: The name Draco is a Latin baby name. In Latin the meaning of the name Draco is: Dragon.
251,8412153,"The campus of Louisiana Tech University is located in Ruston, Louisiana. The major roads that border or intersect the Tech campus are Tech Drive, California Avenue, Alabama Avenue, and Railroad Avenue. Interstate 20 and U.S. Highways 80 and 167 are located within one mile (1.6 km) of the Main Campus."
252,7143654,"in mollusks the heart and organs for digestion, excretion, and reproduction are found in this body region visceral mass the octopus, squid, and chambered nautilus belong to this group of mollusks"
253,8412225,"Over time, our bones are changing, causing us joint pain and fractures, changes caused mainly due to bone demineralisation. This bone demineralisation leads to osteoporosis. Although we are accustomed to think that osteoporosis is a disease that occurs with aging, osteoporosis is actually a consequence of our lifestyle.he most commonly, affected by osteoporosis, bones are the hip and spine, as they are the bones that bear the greatest burden. Although any bone can suffer fractures, the fractures of the hip and spine are the most dangerous and they are often disabling."
254,8412395,"4 Answers 4. The 802.11 protocol can handle 2007 concurrent associations per AP. Note that if you have a simultaneous dual-band AP, it technically counts as two APs for the sake of this limit. Individual AP implementations may have hard limits or soft/practical limits far below that."
255,7144068,"A sink is any place where the plant is using more sucrose than is produced. It may be used for metabolic ATP, to construct new tissues, or being converted to starch for storage. In any case there is less sucrose than needed. 3. At the source, the companion cells actively transport sucrose into the phloem tubes."
256,7144075,"Skulls are innocent and they don't really symbolize anything... That depends on the culture and the context. In some cultures they are venerated as the vessel of the soul, or simply as relics of ancestors. They were also thought to represent wisdom and guidance. They could also symbolize death, either divine or caused by man and were often used as ornaments or weapons to terrorize enemies."
257,8412655,"BodySlide and Outfit Studio, a tool to convert, create, and customize outfits and bodies for Skyrim.Something went wrong with that request. Please try again. You signed in with another tab or window.odySlide and Outfit Studio, a tool to convert, create, and customize outfits and bodies for Skyrim."
258,7144166,"Official state symbols, emblems, and icons of Louisiana - places to see in Louisiana - landmarks, parks, historic markers, cities and towns - learn the culture and history of Louisiana! Skip to main content"
259,7144286,"Contact Outlook Customer Service: Email, Phone Number & Fax Contact Outlook Customer Service. Find Outlook Customer Support, Phone Number, Email Address, Customer Care Returns Fax, 800 Number, Chat and Outlook FAQ."
260,7144307,"What does the Fifth Amendment guarantee? gives due process, protects against double jeopardy, protects against being forced to testify against oneself What does the Sixth Amendment guarantee? rights to a speedy trial, counsel, confront hostile witnesses, and to know the charges against oneself What does the Seventh Amendment guarantee?"
261,7144322,"Ryan Reich didn't have Ryan Reich own trading book and Ryan Reich made no personal profit from the conduct complained of by the The SFO, the public interest does not require the delay, expense, uncertainty and personal agony of a retrial in this case."
262,7144401,"Dual citizenship is a confusing issue, and the United States’ stance on being a US citizen and a citizen of another country can be pretty complex. Dual citizenship is allowed in the United States, but only under certain circumstances."
263,7144406,"Dual Citizenship: The U.S. government allows dual citizenship. United States law recognizes U.S. Dual Citizenship, but the U.S. government does not encourage it is as a matter of policy due to the problems that may arise from it."
264,8413221,"Budget Analyst I Salaries. How much does a Budget Analyst I make? The median annual Budget Analyst I salary is $53,604, as of March 31, 2017, with a range usually between $47,276-$60,575, however this can vary widely depending on a variety of factors."
265,7144605,"Synonym Discussion of grasp. take, seize, grasp, clutch, snatch, grab mean to get hold of by or as if by catching up with the hand. take is a general term applicable to any manner of getting something into one's possession or control."
266,7144974,"What is a transient ischemic attack? A transient ischemic attack (TIA) happens when blood flow to part of the brain is blocked or reduced, often by a blood clot. After a short time, blood flows again and the symptoms go away. With a stroke, the blood flow stays blocked, and the brain has permanent damage."
267,7145026,"The definition of time-honored is long-standing, revered or followed as a result of a long tradition or history. If your family has a 20-year tradition of decorating the Christmas tree on Christmas eve, this tradition is an example of something that would be described as a time-honored tradition. time-honored. time-honored."
268,8413630,Prescribed Esomeprazole. lactitol monohydrate syrup (5 ml with 100 ml water) for constipation problem as prescribed by the doctor.he has not been eating well after we start to give lactitol .is it right medicine for his problem ...
269,7145362,"FDA-approved ultrasound therapy boosts aging skin. Many people don’t realize that ultrasound imaging can be used to lift skin and promote collagen production. One such noninvasive treatment, Ultherapy®, has been approved by the Food and Drug Administration (FDA). Practitioners use the ultrasound treatment to target deep tissue layers."
270,7145417,The definition of UNCRC is United Nations Convention on the Rights of the Child. United Nations Convention on the Rights of the Child Now you know - UNCRC means United Nations Convention on the Rights of the Child.
271,7146043,"Three weeks later her triglyceride level had fallen to 218 mg per deciliter, with a cholesterol level of 279 mg per deciliter, an HDL level of 37 mg per deciliter, an LDL level of 198 mg per deciliter, and an amylase level of 30 IU per liter."
272,7146124,"1 meanings of PE acronym and PE abbreviation in Microsoft Windows. Get the definition of PE in Microsoft Windows by All Acronyms dictionary. Top Definition: Pre-installation Environment In Microsoft Windows. Search for acronyms, abbreviations,"
273,8414852,"No, Charles Manson is not on death row. His death sentence was changed to life imprisonment after the Supreme Court of the State of California acted to abolish the death penal … ty.His next scheduled parole hearing is in 2012. Links to some Related questions can be found below.e and his 'family' members were given the death penalty in the sentencing phase of the trial in 1969-197 … 0. In 1972 the Supreme Court abolished the death penalty due to it's cruel and unusual punishment on prisoners."
274,7146223,What is the meaning of the Spanish word firmés? What is the meaning of the Spanish word ¡firmes? What is the meaning of the Spanish word firmes? What is the meaning of the Spanish word fírmense? What is the meaning of the Spanish word firmen? What is the meaning of the Spanish phrase firmeza de carácter? What is the meaning of the Spanish phrase firmeza de contacto? What is the meaning of the Spanish word firmezas? What is the meaning of the Spanish word firmo? What is the meaning of the Spanish word firmó? What is the meaning of the Spanish word fiscal?
275,8014659,"Ventricular diastole is when the ventricles are relaxing, while atrial diastole is when the atria are relaxing. Together they are known as complete cardiac diastole. During ventricular diastole, the pressure in the (left and right) ventricles drops from the peak that it reaches in systole. When the pressure in the left ventricle drops to below the pressure in the left atrium, the mitral valve opens, and the left ventricle fills with blood that was accumulating in the left atrium."
276,8014825,This electric choke kit is designed to replace the manual choke on your Holley carburetor. Not all parts are needed. for every installation. NOTE: This installation should be done OFF the vehicle. 2. Figure 1 Figure 2. 1. Remove the three (3) screws securing the manual choke.
277,8014842,"However, the number of available stocks differs per month, so that the value for k (in this case a range) needs to be adapted every time. Furthermore, the value for k needs to be rounded up for the first four quintiles, the last quintile consists of the remaining number of stocks."
278,8015082,Eco-friendly synonyms and Eco-friendly antonyms. Top synonym for eco-friendly (another word for eco-friendly) is green.
279,8015184,"An Overlooked Synonym of the Giant Toad Bufo marinus (Linnaeus) (Amphibia, Anura, Bufonidae) Butyrylcholinesterase (BChE) is an enzyme which has been shown to be involved in the patho-genesis, treatment and prognosis of Alzheimer鈥檚 disease. In..."
280,7146589,"The false vampire bat, also known as the spectral bat, is an omnivore that is known for preying on other bats. It can have a wingspan of 30 inches or longer. It is called the false vampire bat because of its long canine teeth which has incorrectly led people to believe that it is a vampire bat and that it drinks blood."
281,8015297,"Definition. Organizational structure, planning activities, responsibilities, practices, procedures, processes, resources, and standards (such as ISO 14000 or BS 7750) employed in formulating an organization's environmental policy and achieving its objectives on both short-and long-term basis."
282,7146833,"In the normal communication process, dopamine is released by a neuron into the synapse (the small gap between two neurons), where it binds to specialized proteins called dopamine receptors on the neighboring neuron. By this process, dopamine acts as a chemical messenger, carrying a signal from neuron to neuron. Drugs of abuse can interfere with this normal communication process. For example, cocaine acts by binding to the dopamine transporter, blocking the removal of dopamine from the synapse."
283,7146836,"Another specialized protein called a transporter removes dopamine from the synapse to be recycled for further use. 8. Drugs of abuse can interfere with this normal communication process. For example, cocaine acts by binding to the dopamine transporter, blocking the removal of dopamine from the synapse."
284,7146842,"Normally, dopamine is then recycled back into the transmitting neuron by a specialized protein called the dopamine transporter. If cocaine is present, it attaches to the dopamine transporter and blocks the normal recycling process, resulting in a buildup of dopamine in the synapse, which contributes to the pleasurable effects of cocaine."
285,7146873,Students will learn: The effects of a volcanic eruption on a community. The effects of a volcanic eruption on the Earth’s environment and geological structure. The different geological features/events of a volcanic eruption. About the possible warning signs of a volcanic eruption.
286,8015607,"4 tips for coping with an enlarged prostate. When a man reaches about age 25, his prostate begins to grow. This natural growth is called benign prostatic hyperplasia (BPH) and it is the most common cause of prostate enlargement. BPH is a benign condition that does not lead to prostate cancer, though the two problems can coexist. Although 50% to 60% of men with BPH may never develop any symptoms, others find that BPH can make life miserable."
287,8015608,"In young men the prostate is about the size of a walnut, but it gets bigger with age. The prostate sits underneath the bladder, and surrounds the top part of the urethra. Urine passes through the urethra on its way from the bladder to the penis. A side view showing the main parts of the male reproductive system."
288,7147096,It can cause renal stones. It is in the sulfa family of drugs and therefore should not be used by patients allergic to sulfa drugs. The medication should be discontinued in patients who develop a rash. The medication does not interfere with birth control pills. Its safety in pregnancy is not known. There are drug interactions with other AEDs.
289,7147377,Marks written above the text to indicate the relative contour of the melody are called:
290,8016075,Iv'e been thinking of becoming a member at lifetime fitness so i don't only have to go with my friends family... but also how many times a month can you be a guest with the same person at lifetime. Follow. 12 answers 12.
291,7147504,"DISCOVER THE ORIGINS OF THE MODERN CITIZEN-SOLDIER. The Army Reserve was founded on April 23, 1908, when Congress passed a bill authorizing the Army to establish a reserve corps of medical officers. At the time, it was composed of 160 medical professionals. Today, the Reserve has over 205,000 Soldiers of many different specialties. View History Infographic >"
292,8016133,"Sleepwalking has been described in medical literature dating before Hippocrates (460 BC-370 BC). In Shakespeare's tragic play, Macbeth, Lady Macbeth's famous sleepwalking scene (out, damned spot) is ascribed to her guilt and resulting insanity as a consequence of her involvement in the murder of her father-in-law. Sleepwalking is characterized by complex behavior (walking) accomplished while asleep."
293,8016163,"The circle has infinitely many lines of symmetry, any line going through the center. (Any diameter is a line of symmetry.) The parallelogram pictured has no lines of symmetry. Neither does the trapezoid. << back to Problem A1. Problem A2. Each regular polygon has as many lines of symmetry as it has sides."
294,8016167,"The circle has infinitely many lines of symmetry, any line going through the center. (Any diameter is a line of symmetry.) The parallelogram pictured has no lines of symmetry. Neither does the trapezoid. Each regular polygon has as many lines of symmetry as it has sides."
295,7147674,"Second Amendment. The Second Amendment to the U.S. Constitution reads: A well regulated Militia, being necessary to the security of a free State, the right of the people to keep and bear Arms, shall not be infringed. The subject matter and unusual phrasing of this amendment led to much controversy and analysis, especially in the last half of the twentieth century."
296,8016392,"Barbie Skating Style3.963965. There are 908 games related to barbie phone games, such as Design Your Phone and Smashing The Phone that you can play on MaFa.com for free. barbie phone games Games."
297,7147920,"Each account in the chart of accounts is typically assigned a name and a unique number by which it can be identified. (Software for some small businesses may not require account numbers.) Account numbers are often five or more digits in length with each digit representing a division of the company, the department, the type of account, etc."
298,7147988,"Chase Total Checking® + Chase SavingsSM Earn a $200 bonus when you open a new Chase Total Checking® account and set up direct deposit. Also earn a $150 bonus when you open a new Chase SavingsSM account, deposit a total of $10,000 or more in new money within 10 days & maintain a $10,000 balance for 90 days."
299,7148035,"1 City of Pontiac Crime Records, Last Recorded 2014 (Updated 08/31/2017) 2  City of Pontiac American Community Survey (ACS) 2014 Census Bureau. 3  City of Pontiac Census Data. 4  Closest Cities and Towns to The City of Pontiac, IL."
300,7148039,"City of Pontiac, IL Free Public Records Directory. Departments which record, maintain and provide official documents, certificates or information requested by the general public. City of Pontiac Official Website: Government department official public web-portal. City of Pontiac Municipal Codes: City ordinances governing cities, villages, parishes and jurisdictions below state level. Pontiac Crime Maps: Mapping of Pontiac street locations of criminal reported activity from local law enforcement agencies. Latest Obituaries in Pontiac Illinois: Published recent deaths, name, date and age. Pontiac Public Schools:"
301,7148041,"1 Questions, Answers and Comments About City of Pontiac, IL Public Records. 2  Ask Questions, View Answers and Post Comments About City of Pontiac, IL Public Records. 3  Search for Questions, Answers and Comments About City of Pontiac, IL Public Records."
302,8016721,Brett Allred of HQ Cabinets shows you how to apply a pinstripe glaze to your kitchen cabinets. www.hqcabinets.com. 1  Howto & Style. 2  Standard YouTube License.
303,8016796,Drive a finish nail into the baseboard. Hold the nail at a slight angle to the floor just above the bottom of the baseboard and tap lightly with a hammer until the head of the nail is just above the surface of the molding.
304,7148192,"show more Me and my best friend of like 17 years, want to get matching tattoos. You know that kind that you get around a finger. Alot of people do it for marriage. But we thought it would be cool to get some kind of word that means friendship around a finger that would symbolize friendship. Does anyone know the correct... show more Me and my best friend of like 17 years, want to get matching tattoos. You know that kind that you get around a finger. Alot of people do it for marriage. But we thought it would be cool to get some kind of word that means friendship around a finger that would symbolize friendship. Does anyone know the correct finger to put something like that on? im sure you can do any, but i want it to be more meaningful you know."
305,7148203,"When you go to see the system for the first time, be sure to bring the following items if you can: 1  A working USB and FireWire hard drive (preload it with a fully updated version of OS X if you can -- at least use Snow Leopard, but OS X Lion is preferable) A robust drive management tool like Drive Genius or TechTool Pro (you can also preload this on the external hard drive) An external headphone."
306,7148299,"As a flower which blindly follows the sun, sunflowers have become a symbol of infatuation or foolish passion. Thistle. A thorny plant with a beautiful flower, the national symbol of Scotland. It's thorns symbolize both evil and protection. In Christianity, it represents the suffering of Christ. Violet. Symbolize faithfulness, humility, and chastity."
307,714845,"Keep exercising as hard as when you were trying to lose weight. Don't scale back on your workouts in a bid to halt your weight loss - you can always adjust how many calories you eat if need be. To find out exactly how many calories you should eat each day to maintain your weight, read our article on calories for women."
