,7130104,This is the definition of RNA along with examples of types of RNA molecules. This is the definition of RNA along with examples of types of RNA molecules. RNA Definition
0,7130335,"Best Answer: The AR designation comes from the name of the company that produced the firearm - Armalite. It is a common misconception that it stands for assault rifle. From Wikipedia: The AR-15 is based on the 7.62mm AR-10, designed by Eugene Stoner of the Fairchild ArmaLite corporation."
1,7130336,"What does AR really mean? Posted by Quality AR barrels | Jul 29, 2016 | AR Articles | Over the years the media has programmed the public into thinking that AR stands for Assault Rifle. This is not the case. To follow is a short history and overview of the ArmaLite rifle."
2,7130348,"Oxycontin is generally prescribed without acetominophen while oxycodone is generally prescribed with. The will show the same on a drug panel. They last in your system for upto 5 days after your last dose depending on your frequency, strength and personal metabolism. Laurie."
3,8001869,"STRATEGIC FEDERAL CREDIT UNION Routing number is printed on the lower left corner of the Check Book. At the bottom of the check, you will find 3 groups of numbers. The first group is Routing number, the second group is your bank account number and the final group is your check number."
4,8001870,"Strategic federal credit union routing number List of Strategic federal credit union routing numbers with branch details. What is Strategic federal credit union routing number? Strategic federal credit union routing number is a nine digit number used to identify bank transfers. Routing numbers will be different based on the account branch. It is based on the bank account origin by state and region. The routing number on check is available for each branch in the table below. In order to find the check routing number of the branch you are looking for, click on the Details link next to the branch name."
5,7130674,Just reformat the cell manually by (in Excel 2003 and older) going to Format > Cells > General or (in Excel 2007 and later) choosing General from the dropdown in the Format section of the Home tab. We need to convert this number of days into a number of years.
6,7130867,"Binary (or base-2) a numeric system that only uses two digits — 0 and 1. Computers operate in binary, meaning they store data and perform calculations using only zeros and ones."
7,8002085,"The SEC, however, defines a high net worth individual as someone who has at least $750,000 under management or whom an investment adviser believes to have a net worth of $1.5 million or more. Many investment vehicles target high net worth individuals because they have more money to invest.here is no hard-and-fast definition of a high net worth individual, though a net worth in excess of $1 million usually qualifies."
8,7131236,"A Call Option in stock market is basically a contract to buy a specific stock, at a specific price on a specific date. When you purchase the stock your risk is unlimited in a sense that you might lose your entire capital or incalculable part of it, but when you purchase calls your risk is only limited to the premium paid. You are under no obligation to purchase the stock. Generally calls of a particular stock are purchased by a person when they are bullish on it or if they wanted to hedge a specific position. Options are riskier and more volatile than the underlying stock. A mere few percent move in a stock may turn out to be over a 100% or more move in the options."
9,7131238,"Option Types: Calls & Puts In the special language of options, contracts fall into two categories - Calls and Puts. A Call represents the right of the holder to buy stock."
10,7131240,"What do call and put options mean? What about a put/call ratio? If a lot of calls are made on a stock. Does that mean people think the stock will do well? Same for a put option. Also if a put/call ratio increases, does that mean people are becoming optimistic about the stock?"
11,7131241,"You can use a call option to purchase stock, but most traders use a call to speculate on a change in price (premium) of the call, just like trading a stock to the upside. You can also sell a covered call to hedge your stock position, but this mostly benefits your broker."
12,7131242,"A Call Option in stock market is basically a contract to buy a specific stock, at a specific price on a specific date. When you purchase the stock your risk is unlimited in a sense that you might lose your entire capital or incalculable part of ..."
13,7131322,The customer support phone number of Exede Contact is 855-463-9333 (Click phone number to call). data-ad-slot=7829909793> Exede Customer Service Phone Number Exede Contact Customer Service Phone Number Phone Number of Exede Contact is 855-463-9333. Exede is the broadband service through satellite and was launched in October 2011 through ViaSat-1.
14,8002670,"Rep. Mark Sanford speaks about Obamacare repeal and replacement with members of the House Freedom Caucus during a news conference on Capitol Hill on March 7. After pulling his wildly unpopular American Health Care Act, House Speaker Paul Ryan tried to put a brave face on a stinging defeat."
15,8002855,"When I took out the cooked roast, I dried it with paper towels…. …and blasted it with my kitchen torch. I sliced up the roast and every piece was moist and cooked perfectly all the way through. I can’t imagine cooking pork any other way. 1  sous vide.  sous vide pork loin roast."
16,8003157,Glass and Thermal Stress. Thermal Stress is created when one area of a glass pane gets hotter than an adjacent area. If the stress is too great then the glass will crack. The stress level at which the glass will break is governed by several factors.
17,7131638,The name Marta is a Polish baby name. In Polish the meaning of the name Marta is: Bitter. American Meaning: The name Marta is an American baby name. In American the meaning of the name Marta is: Bitter.Aramaic Meaning: The name Marta is an Aramaic baby name.In Aramaic the meaning of the name Marta is: Lady. Scandinavian Meaning: The name Marta is a Scandinavian baby name. In Scandinavian the meaning of the name Marta is: Lady.Spanish Meaning: The name Marta is a Spanish baby name. In Spanish the meaning of the name Marta is: Lady.Swedish Meaning: The name Marta is a Swedish baby name. In Swedish the meaning of the name Marta is: Lady.he name Marta is a Polish baby name. In Polish the meaning of the name Marta is: Bitter. American Meaning: The name Marta is an American baby name. In American the meaning of the name Marta is: Bitter. Aramaic Meaning: The name Marta is an Aramaic baby name.
18,8003310,"You need a web browser that supports JavaScript to use our site. Without it, some pages won’t work as designed. To make sure JavaScript is turned on, please adjust your browser settings and refresh."
19,8003320,"White nails. If most of the nail has turned white and it isn't because it has become detached from the nail bed, it's likely to be either a fungal nail infection or a sign of decreased blood supply to the nail bed, which causes something known as Terry's nails."
20,7131647,if bow legs is caused by the bone alignment issue than you may be able to correct through bow legs correction exercises. read more here.. if bow legs is caused by the bone alignment issue than you may be able to correct through bow legs correction exercises.
21,8003559,"Begin every morning by drinking the Sassy water and drink it during the day in small portions, from morning to evening. In the evening again prepare a new portion of the water. This fantastic potion gives amazing results. At the same time, there are no food restrictions."
22,7132190,"A broken nose, also called a nasal fracture or nose fracture, is a break or crack in the bone or cartilage of your nose. These breaks typically occur over the bridge of the nose or in the septum, which is the area that divides your nostrils."
23,7132338,"CTB stands for catch the bus, e.g. commit suicide. It could also stand for cease to breathe, another suicide reference. CTB stands for catch the bus, e.g. commit suicide. It could also stand for cease to breathe, another suicide reference. Bob was tired of life, so he decided to CTB."
24,7132810,"2.Dislike, disgust, distaste, repugnance imply antipathy toward something. Dislike is a general word, sometimes connoting an inherent or permanent feeling of antipathy for something: to have a dislike for crowds. Disgust connotes a feeling of loathing for what is offensive to the feelings and sensibilities: He felt disgust at seeing such ostentation."
25,7132942,"Movie (2017). The LEGO Ninjago Movie is set to be released on the 26 of September 2017. It will be a spin-off of the LEGO movie and will be CGI animated to look like a stop-motion. The story is unknown, except that it will diverge from the plot of the TV series."
26,7133139,"E pluribus unum E pluribus unum —Latin for Out of many, one —is a phrase on the Seal of the United States, along with Annuit cœptis and Novus ordo seclorum, and adopted by an Act of Congress in 1782."
27,7133141,Definition of e pluribus unum in the Definitions.net dictionary. Meaning of e pluribus unum. What does e pluribus unum mean? Information and translations of e pluribus unum in the most comprehensive dictionary definitions resource on the web.
28,7133256,"Electrical engineering - Education. 1  Electrical engineers typically possess an academic degree with a major in electrical engineering, electronics engineering, electrical engineering technology, [60] or electrical and electronic engineering."
29,7133282,"Elijah McCoy - Biography. The inventor was born in 1843, in Colchester, Ontario, Canada. His parents were former slaves, George and Mildred McCoy (nee Goins) had fled Kentucky for Canada on the underground railroad."
30,8003745,"Determining your taxable gain on inherited stocks is more straight forward than with gifted stocks. To figure out your cost basis, set the Fair Market Value (FMV) of the stock on the date of your benefactor's death to your new cost basis. Use the average of the high and low prices of the stock on that date as the FMV."
31,8003753,For details of how to format and partition a drive see How to format a Hard Drive partion in Windows XP. 1  Step 2. Download and unzip the XXCLONE Freeware package from Pixelab. 2  Step 3. Run xcfwinst_0580.exe from the folder you unzipped to. 3  Step 4. Run XXClone from Start/All programs/XXClone or the desktop icon.
32,8003756,Significantly painful rob fractures may require stronger pain medications. Rib fractures may tale 4 to 8 weeks to heal. Your discomfort may be improved by also wearing a rib belt. Significantly displaced rib fractures will need close monitoring.
33,8003763,"You're in luck, says David Conger, fishmonger and owner of Capt'n Dave's Seafood Market in Plano, who has made crawfish a specialty. When the weather's great, the crawfish come out to feed, he says."
34,8003846,Lower Blood Sugar Naturally With These 5 Ingredients. By lowering blood sugar levels naturally with these 5 potent ingredients the body may mimic the effects of insulin in order to better assimilate carbohydrates in the food. Maintaining healthy blood sugar levels is essential for weight loss.
35,8003925,"If issued at a premium, the company pays less at maturity relative to the issue. price. The company records this adjustment to the cost as bond interest expense over the. life of the bonds through a process called amortization. Amortization of a discount. increases bond interest expense. Amortization of a premium decreases bond interest. expense."
36,713369,Drug/Vaccine Refrigerator-Temperature Checking / Cleaning Procedure. 6.1 The medication refrigerator and the temperature of the room the medications are stored in needs to be monitored on a weekly basis. If your. contains. vaccinations the refrigerator’s temperature needs to be monitored on a daily basis.he “IN” temperature should be below 25 ºC. The “OUT” temperature is the temperature within the fridge. The “OUT” temperature should be between 2-8 ºC. This Procedure shall be performed by a: This Procedure requires: i) Electronic thermometer of an approved type. 1. Purpose 2.
37,713370,Details. Our range of Lec Medical pharmacy refrigerators maintain an internal temperature between +2°C and +8°C and use an external digital temperature controller to continuously monitor the minimum and maximum temperature.etails. Our range of Lec Medical pharmacy refrigerators maintain an internal temperature between +2°C and +8°C and use an external digital temperature controller to continuously monitor the minimum and maximum temperature.
38,8003993,"I've found that regardless of the style and instructor, as long as it is not a relaxing yoga, it will build muscle. In other words, it will make getting through the next yoga class, regardless of style, easier."
39,7133739,"These changing quantities are called variables, and an experiment usually has three kinds: independent, dependent, and controlled. The independent variable is the one that is changed by the scientist. In an experiment there is only one independent variable. As the scientist changes the independent variable, he or she observes what happens. The dependent variable changes in response to the change the scientist makes to the independent variable. The new value of the dependent variable is caused by and depends on the value of the independent variable. (the independent variable), the quantity of water flowing (dependent variable) changes in response--the water flow increases. The number of dependent variables in an experiment varies, but there is often more than one."
40,7133740,"The independent variable is the one the scientist changes during an expert, while the dependent variable is the one the scientist measures to determine the results of the experiment. The independent variable is the one the scientist changes during an expert, ..."
41,7133790,"What Does FBO Mean? FBO means Facebook Official. When two people are in a relationship, declaring the status of the relationship publicly on social media is considered an important step in making the relationship official. Many people may question the legitimacy of a relationship if it has not been published on Facebook. FBO is not just for positive statuses."
42,7133847,Alternative Aid Assistance is a program to assist TANF eligible parents who need short term help to find or maintain employment. Voucher payments equal to up to three months worth of TANF benefits are available to families to help them avoid the need for TANF benefits. Food Supplement Employment and Training (FSET) Program. Food Supplement and Training (FSET) is a program that helps Food Supplement recipients find employment and training.
43,8004107,Top related threads. 1  Create subsite from a Site Definition made ​​VStudio 2010. 2  Need our site definition appears only when creating a site collection and not a subsite. 3  Sharepoint subsites in Site Definition. 4  Are subsites affected by reset to site definition. 5  Provisioning Subsites with Site Definition and Workflow.
44,8004162,"For a man whose nickname suggests he'll scoff anything (he's fondly known as Hugh Fearnley-EatsItAll), there is at least one thing he won't put anywhere near his mouth, as he reveals: I certainly wouldn't eat the white on top of a fried egg if it was still transparent."
45,8004227,One cause of a false positive pregnancy test is that you do not read your urine pregnancy test correctly. Pregnancy tests have certain instructions and before you make the diagnosis of a positive pregnancy test make sure that you followed all instructions.
46,7134595,"Yellow: combines with blue, lilac, light-cyan, violet, gray, black. Lemon-yellow: combines with cherry-red, brown, blue, gray. Pale-yellow: combines with fuchsia, gray, brown, shades of red, yellowish brown, blue, purple. Golden yellow: combines with gray, brown, azure, red, black. Olive: combines with orange, light-brown, brown."
47,7134596,"Salad green: combines with brown, yellowish-brown, fawn, gray, dark-blue, red, gray. Turquoise: combines with fuchsia, cherry-red, yellow, brown, cream, dark-violet. Electric colors: combines with golden-yellow, brown, light brown, gray, or silver. Cyan: combines with red, gray, brown, orange, pink, white, yellow. Dark-blue: combines with light-lilac, cyan, yellowish-green, brown, gray, pale-yellow, orange, green, red, white. Lilac: combines with orange, pink, dark-violet, olive, gray, yellow, white. Dark-violet: combines with golden-brown, pale-yellow, gray, turquoise, mint green, light-orange. Black is a universal colour — it looks elegant in any combination, especially with orange, pink, salad green, white, red, mauvish, or yellow."
48,8004290,"The annual limit for cash and stocks and shares ISAs combined is £15,240 for the 2015/16 tax year. You can invest the full allowance in cash if you want to, or in stocks and shares, or a combination of the two."
49,7134879,"When Trading Stops: What You Need to Know About Halts, Suspensions and Other Interruptions. Thousands of stocks are quoted and traded every day in U.S. securities markets. Trading in most stocks takes place without interruption throughout the trading day—but some stocks are subject to short-term trading halts and longer-term trading suspensions. In rare instances when the market experiences a very steep decline, trading across the entire market can be stopped."
50,7134939,Gas Price Heat Map; Trip Cost Calculator; Fuel Logbook; Gas Price Charts; Win Prizes; Fuel Saving Tips
51,8004831,"Using sunlamp products such as tanning beds or tanning booths increases the risk of skin damage, skin cancer and eye injury, according to the Food and Drug Administration (FDA) and numerous other health organizations. A particularly dangerous result is melanoma, the deadliest type of skin cancer."
52,7135041,"HEENT stands for. 1  11. similar. HEENT. 2  5. HEENT. Head, Eyes, Ears, Nose, Throat. 3  4. HEENT. Head, Ears, Eyes, Nose And Throat. 4  4. HEENT. Head Eyes Ears Nose Throat. 5  4. HEENT. Head Ears Eyes Nose Throat. 6  4. HEENT. Head, Eyes, Ears, Nose, and Throat. 7  4. HEENT. HEAD, EYES, EARS, NOSE AND THROAT. 8  3. HEENT. Head, Eye, Ear, Nose And Throat."
53,8004928,"If you have any form of diabetes you know that you never want your blood sugar to spike over 300 as it can severely harm your organs and the rest of your body. But things like diet, stress, illness and infection can cause your blood sugar levels to go temporarily out of whack.If your blood sugar level spikes past 300, see a doctor immediately if possible. If you have to wait to see a doctor or can’t get to one, there are a few quick fixes you can do to get the level to drop.at a collection of foods that are low on the glycemic index, or that will help bring you blood sugar level down. Foods like garlic, eggs, onions, peanuts and peanut butter are all low on the glycemic index and will help stabilize your blood sugar levels."
54,7135097,Herbivory: Definition & Examples 4:44 Next Lesson. Allometric Growth: Definition & Example; Isometric Growth: Definition & Example; Go to AP Biology - Animal Behavior: Help and Review
55,8004958,"Sometimes, you find that you buy a cheap supplement, but it takes a long time before you see any benefits, or you may not see any benefits at all. The Glucocil ingredients have been carefully selected and formulated, to make sure that your body can put them to good use."
56,8005090,"The mere addition of water to your diet won’t help you lose weight -- this is a health myth. However, there may be benefits to this strategy, if drinking more water means drinking less soda or sugar-added fruit drinks. Nothing beats an improved diet and being more active for losing weight."
57,7135553,"After you buy stock on margin, FINRA requires you to keep a minimum amount of equity in your margin account. The equity in your account is the value of your securities less how much you owe to your brokerage firm. The rules require you to have at least 25 percent of the total market value of the securities in your margin account at all times."
58,7135558,05/08/08 Buying on margin means that you are buying your stocks with borrowed money _____ It means that you've borrowed money to finance your stock purchase. This is very risky and may lead to a margin call if the share price declines.
59,8005683,"Givaudan was founded as a perfumery company in 1895 in Zurich (Switzerland) by Leon and Xavier Givaudan, although some parts of the modern company date back as far as 1796. In 1898 Givaudan moved to Geneva (Switzerland) and constructed a factory in Vernier."
60,8005808,"After Peter Parker was resurrected from a battle to the death against Morlun, his friend and teammate Tony Stark built him a new suit, using Stark Tech, and obviously influenced by the colors of Stark's Iron Man Armor.Schematics of Model V1.1.fter Peter Parker was resurrected from a battle to the death against Morlun, his friend and teammate Tony Stark built him a new suit, using Stark Tech, and obviously influenced by the colors of Stark's Iron Man Armor. Schematics of Model V1.1."
61,7135868,"Face-Tite™ can precisely target patients’ areas of concern and has been effectively used to tighten and lift facial areas like the lower eyes, brow, cheek, neck, and jowls. This is an excellent alternative to the facelift for those who have unwanted fat or skin laxity and do not want to undergo more invasive surgery."
62,7135939,"What Does It Mean to Park a Domain Name? Domain Name Parking Explained by Christopher Heng, thesitewizard.com. One of my visitors, while reading the article on How to Register a Domain Name, was puzzled by the concept of domain name parking. This article explains what it means and describes the situations when you may want or need to park your domain name as well as its downsides. What is a Domain Name?"
63,8006856,The Pontiac Vibe is a compact hatchback automobile that was sold by Pontiac from 2002 to 2010.
64,8006894,"In addition to state unemployment tax, the Federal Unemployment Tax Act (FUTA). It is reported on the IRS Form 940 or Schedule H and is on the first $7,000 paid to each employee (visit www.irs.gov). The FUTA tax rate is 6.0 percent."
65,8007022,What is Comerica bank routing number? Comerica bank routing number is a nine digit number used to identify bank transfers. Routing numbers will be different based on the account branch. It is based on the bank account origin by state and region. The routing number on check is available for each branch in the table below.
66,8007563,"Our Story. In 1764, Castle Hill opened its doors, hosting over the years an array of creative minds, from dignitaries and politicians to explorers and novelists. Today, its creative legacy continues with artisan cider makers handcrafting cider on the property."
67,8007629,"Stock options are generally traded with strike prices in intervals of $2.50 up to $30 and in intervals of $5 above that. Also, only strike prices within a reasonable range around the current stock price are generally traded. Far in- or out-of-the-money options might not be available."
68,8007799,"$0+. 4.63%. Colorado has two marginal tax brackets, ranging from 4.63% (the lowest Colorado tax bracket) to 4.63% (the highest Colorado tax bracket). Each marginal rate only applies to earnings within the applicable marginal tax bracket, which are the same in Colorado for single filers and couples filing jointly."
69,8007908,"The sourest naturally occurring foods are probably lemons/limes, but man made products such as certain candies are even more sour. The sweetest naturally occurring food is Stevia, a plant native to Paraguay and Brazil."
70,8007989,In simple linear regression a single independent variable is used to predict the value of a dependent variable. In multiple linear regression two or more independent variables are used to predict the value of a dependent variable. The difference between the two is the number of independent variables. In both cases there is only a single dependent variable.
71,840116,Dental device used to hold a matrix band in place during restoration of a class II cavity. Wedge Wooden or plastic triangular device placed in the embrasure to provide the contour needed when a class II lesion is restored.
72,8401268,"In 1983, the meter was defined as the distance that light travels in vacuum in 1/299,792,458 of one second. The kilometer (British spelling: kilometre; abbr. km) is a length unit from the International System of Units. It equals to 1000 meters and is traditionally used to express distances between geographical objects."
73,8401274,"This article is about the historic details of computer software company UGS prior to the 2007 acquisition by Siemens. For the amalgamated company, see Siemens PLM Software. UGS was a computer software company headquartered in Plano, Texas, specializing in 3D & 2D Product Lifecycle Management (PLM) software."
74,8402036,"My Nuvi 1450 has always shown my home location about 100 to 150 feet down the street no matter what solution was tried. It has been reset, good signal, most recent updates. I just replaced the 1450 with a 2797 which shows the correct home location out of the box. have a nuvi 1450 lmt that I want to use in a vehicle with a 6 volt system. I'll need to use the Garmin for 8-10 hours at a time which will exceed its 3 hour battery life."
75,8402131,"IRS Taxpayer Assistance Centers (TACs) are your source for personal tax help when you believe your tax issue can only be handled face-to-face. Keep in mind, many questions can be resolved online without waiting in line. Through IRS.gov you can: • Set up a payment plan."
