774,8436974,"Terry Bradshaw won four Super Bowls during his NFL career with the Pittsburgh Steelers. The star quarterback led his team to titles in 1975, 1976, 1979 and... Terry Bradshaw won four Super Bowls during his NFL career with the Pittsburgh Steelers. The star quarterback led his team to titles in 1975, 1976, 1979 and 1980. Bradshaw entered the NFL during the 1970 season after a stellar collegiate career at Louisiana Tech."
775,8437025,"Types of Lentils, Legumes and Dried Beans to use for Homemade Baby Food. Lentils and dried beans/legumes come in many shapes, sizes and colors. How to Cook and Soak Legumes and Dried Beans. No matter what type of dried bean you are preparing, the cooking instructions are the same."
776,716913,The average maturity of the new debt issued each year has consistently been shorter than the average maturity of the total stock of debt — and was actually shorter in the 2012 fiscal year than it was in the 2011 fiscal year.
777,5175763,"But the female-centric, celebratory nature of the film (the fantasies, the sharing, the witchy bonds) is infectious, and supporting roles by Dianne Wiest and Stockard Channing as Kidman and Bullock's magical aunts are a lot of fun."
778,51758,"Ankle Conditions. 1  Sprained ankle: Damage to one of the ligaments in the ankle, usually from an accidental twist or turn of the foot. 2  High ankle sprain: The ligament joining the two bones of the lower leg (tibia and fibula), called the syndesmotic ligament, is injured. 3  Ankle fracture: A break in any of the three bones in the ankle."
779,5175846,"PRISM began in 2007 in the wake of the passage of the Protect America Act under the Bush Administration. The program is operated under the supervision of the U.S. Foreign Intelligence Surveillance Court (FISA Court, or FISC) pursuant to the Foreign Intelligence Surveillance Act (FISA)."
780,7169588,"Popular attractions in Ranchi. 1  Jagannath Temple Built on the same architectural lines of Jagannath temple of Puri, the Jagannath temple in Ranchi is an equally important pilgrimage centre and major tourist attraction of Jharkhand."
781,5175970,BK Hacken have won their last 4 home games. BK Hacken have been undefeated in their last 9 home games. Djurgarden conceded at least one goal in 79% of their home games. Djurgarden conceded at least one goal in each of their last 6 home games. Elfsborg scored at least one goal in each of their last 10 games.K Hacken have won their last 4 home games. BK Hacken have been undefeated in their last 9 home games. Djurgarden conceded at least one goal in 79% of their home games. Djurgarden conceded at least one goal in each of their last 6 home games. Elfsborg scored at least one goal in each of their last 10 games.
782,8437650,"Using the hair of the dog that bit you means that someone is using the thing that caused the pain to cure it. The idiom has a historical basis, thanks to the antiquated belief that curing a dog bite required getting some fur from the dog that administered the bite and applying it on the bite area."
783,5176247,"Hydroxocobalamin is a natural form of vitamin B12, prescribed for anemia and vitamin B12 deficiency. Iron - III Hydroxide Polymaltose Complex - IPC. Iron - III Hydroxide Polymaltose Complex - IPC is an iron preparation, prescribed for iron deficiency anemia."
784,8034714,"Developers are often confused by what a callback is because of the name of the damned thing. A callback function is a function which is: passed as an argument to another function, and, is invoked after some kind of event. Once its parent function completes, the function passed as an argument is then called."
785,8034808,"As a prime example, corporations have to pay income taxes, just as a person would. Corporate Tax Rate in Rocky River, Ohio. Every profit-earning corporation in the U.S. must, legally, pay the federal corporate income tax. Many states also have their own corporate income tax, which corporations located in Rocky River, Ohio have to remit. Under federal laws that govern corporate income taxes, corporations pay a different income tax rate from individual people."
786,8034895,"Theoretically, eating fewer calories than you expend can help you lose weight, but the type of calories you eat influences your results. For example, if you eat very low-carb and have trouble sleeping, your hunger levels could rise and you might struggle to keep your calorie intake low enough to lose weight. Or if you don’t eat enough calories from fat or carbs to power your workouts, you could end up burning fewer calories than you think, because you’re not giving it your all in the gym."
787,7169684,"The production of this type of beer in Belgium had nearly ended by the late 1950s. In the town of Hoegaarden, the last witbier brewery, Tomsin, closed its doors in 1955. However, ten years later, a young farmer by the name of Pierre Celis in the same village decided to try reviving the beer."
788,7169692,"Basal metabolic rate, which accounts for about 50 to 70 percent of TEE, is thought to decrease about one to two percent per decade. That is, after a person reaches 20 years old, daily energy expenditure decreases about 150 calories per decade."
789,8035018,You can expect a small egg to have slightly less than 72 calories and an extra-large egg to have slightly more. Here’s a general breakdown by size: small egg (38 grams): 54 calories; medium egg (44 grams): 63 calories; large egg (50 grams): 72 calories; extra-large egg (56 grams): 80 calories; jumbo egg (63 grams): 90 calories
790,8035020,"There are 78 calories in 1 large (1.8 oz) of Whole Egg, fried, without added fat. You'd need to walk 20 minutes to burn 78 calories. Visit CalorieKing to see calorie count and nutrient data for all portion sizes. apps Tools & More help Support"
791,8035063,"Greenville, PA Weather. Greenville, PA climate is mild during summer when temperatures tend to be in the 60's and very cold during winter when temperatures tend to be in the 20's."
792,5176626,Page 1 of 4: CNN Democratic Presidential Debate full video CNN Democratic Presidential Debate full video CNN Republican Presidential debate full video Watch Fox News Presidential Debate video How to watch Democratic Presidential Debate.
793,716980,"Report Abuse. There's nothing wrong with remembering the past with fondness. It's living in the past that's not a good thing. You can't recapture what has already gone by, so living in the present is much more realistic. But there's nothing wrong with happy memories of people and events that touched our lives. don't think that remembering the past is necessarily an unhealthy thing unless of course it's reliving horrible events that you just can't seem to get past. If you're saying oh I wish I could go back well of course you know you can't you just have to try to work on what you can to make your present a happier memory."
794,5176796,"Woman Suffrage Timeline (1840-1920). 1840 Lucretia Mott and Elizabeth Cady Stanton are barred from attending the World Anti-Slavery Convention held in London. This prompts them to hold a Women's Convention in the US. 1848 Seneca Falls, New York is the location for the first Women's Rights Convention. Elizabeth Cady Stanton writes The Declaration of Sentiments creating the agenda of women's activism for decades to come. 1849 The first state constitution in California extends property rights to women. 1850 Worcester, Massachusetts, is the site of the first National Women's Rights Convention. Frederick Douglass, Paulina Wright Davis, Abby Kelley Foster, William Lloyd Garrison, Lucy Stone and Sojourner Truth are in attendance."
795,5176811,"Store Bought Mayonnaise. An open container of store bought mayonnaise will last between one and three months in the refrigerator. Sources vary widely on the shelf life of unopened, commercially-bottled mayonnaise stored in the pantry -- from one week to four months past the sell-by date."
796,8438252,"principal - (criminal law) any person involved in a criminal offense, regardless of whether the person profits from such involvement. criminal law - the body of law dealing with crimes and their punishment. offender, wrongdoer - a person who transgresses moral or civil law."
797,8035228,"Here you will find everything you need to know about diagnosing, treating and rehabilitating a sprained ankle for an effective and speedy recovery. Symptoms Pain is usually felt around the ankle joint itself although more specifically on the outside of the ankle where the damaged ligaments are located."
798,8438320,"Not only will these foods relieve constipation, but they will also promote digestive health by improving your diet. You should aim for at least 24-38 grams of fiber a day. Here are some foods to add to your diet: Avocado, split peas, broccoli, kale, green peas, and lentils."
799,8035230,"Pain in the ankle can result from inflammation or injury to any of the structures in this region, including the bones, joint space, cartilage, ligaments, tendons, or muscles. Ankle pain can be associated with other symptoms including. ankle swelling, bruising, redness, numbness or tingling, instability, burning pain, inability to bear weight on the affected ankle, stiffness, and; weakness. Common causes of ankle pain include sprains or injuries. Rheumatoid arthritis, gout, osteoarthritis, and other types of arthritis can also cause ankle pain. Achilles tendonitis is another potential cause. REFERENCE:"
800,843842,"Provisional Admission Statuses Provision 1. Admitted provisionally by the program of study. This is a temporary classification that a student may remain for a period of two semesters following admission and no longer. If the conditions of the provisional admission are not met within this time, it may result in termination from the academic program. Provision 2 Admitted provisionally by the Graduate School."
801,717033,His method has been used by eating a pea-sized amount of hemp oil from a toothpaste tube (does NOT get the patient 'high'). Hemp oil has also been proven to work when applied topically (under a bandaid) for treating skin cancer and melanoma.
802,8035469,"Langhorne hourly weather, weather by the hour Langhorne Pennsylvania. Hourly weather Langhorne PA. Hourly Weather, 24 hour, 48 hour forecast Langhorne PA. 24 hour and 48 hour weather report Langhorne, PA. By the hour langhorne pa hourly weather. Langhorne Weather"
803,7170543,"An internal stye (on the underside of the lid) also causes a red, painful swelling, but its location prevents the familiar whitehead from appearing on the eyelid. The internal stye may disappear completely once the infection is past, or it may leave a small fluid-filled cyst or nodule that can persist and may have to be opened and drained."
804,5177164,"The cooling rate for a liquid (below boiling) is more complicated since the heat of vaporization changes with temperature, and the rate of evaporation depends upon ambient temperature and relative humidity."
805,5177241,"1 Tell the clerk how much money to enter or enter the purchase amount yourself. 2  Remember, you can only buy eligible food items with your food benefits. 3  Always check your receipt to make sure that the amount on the EBT receipt is the same as your grocery receipt. Look for the Quest® mark on the door or the window of the store. 2  At check-out, your EBT card is swiped. 3  Enter your secret PIN on the number pad, then press Enter. 4  Tell the clerk how much money to enter or enter the purchase amount yourself."
806,7170631,"When you have a flight from Roissy Charles de Gaulle (CDG), take advantage of the various transportation options available. If you’ve bribed your friend to drive you the airport, use the convenient curbside drop-off or the short-term parking at CDG."
807,7170669,"One approach is to have the server computer accounts receive a tighter refresh policy, with the assumption that there are fewer servers than client computers. The refresh interval is defined in Group Policy in the Policies | Administrative Templates | System | Group Policy section in a value called Group Policy Refresh For Computers (Figure A). After the Group Policy Refresh For Computers value is selected, it is represented in minutes that will determine how frequently the computer accounts will try to update the policy."
808,5177272,"The Originals is an American television series that began airing on The CW on October 3. 2013. Created as a spin-off of The Vampire Diaries, the series follows vampire Klaus Mikaelson as he and his family become embroiled in the supernatural politics of New Orleans."
809,7170697,The GDPR’s definition of personal data is considered to be ‘new’ because it varies slightly from the definition that was established under the Data Protection Act from 1998. The new definition is vital because it pretty much creates the entire premise for how companies should react to data protection laws.
810,7170735,"Certification refers to the confirmation of certain characteristics of an object, person, or organization. This confirmation is often, but not always, provided by some form of external review, education, assessment, or audit. Accreditation is a specific organization's process of certification. According to the National Council on Measurement in Education, a certification test is a credentialing test used to determine whether individuals are knowledgeable enough in a given occupational area to be"
811,7170836,"Annuities are made available through Chase Insurance Agency, Inc. (CIA), a licensed insurance agency, doing business as Chase Insurance Agency Services, Inc. in Florida. JPMCB, JPMS and CIA are affiliated companies under the common control of JPMorgan Chase & Co. Products not available in all states. Chase Private Client is the brand name for a banking and investment product and service offering."
812,7170904,Conair Customer Support Service Phone Number The customer support phone number of Conair is (203) 351-9000 (Click phone number to call).
813,7170906,"Our web server automatically collects the domain names (but not the e-mail addresses) of visitors to Conair-Store.com. This information is aggregated to measure the number of visits, average time spent on the site, pages viewed, and other statistical information."
814,7170932,"In recent weeks the Guardian has reported from several of America’s poorest towns, and has now come to this corner of Montgomery County, Maryland, as three communities – Chevy Chase Village, Chevy Chase Town and Chevy Chase Section Five – all have median incomes of more than $250,000."
815,7170935,"Chevy Chase, Maryland is GMT/UTC - 5h during Standard Time Chevy Chase, Maryland is GMT/UTC - 4h during Daylight Saving Time: Daylight Saving Time Usage: Chevy Chase, Maryland does utilize Daylight Saving Time. Daylight Saving Start Date: Chevy Chase, Maryland starts Daylight Saving Time on Sunday March 11, 2018 at 2:00 AM local time. Daylight Saving End Date"
816,80359,"In chemistry, pK is the logarithmic value of the dissociation constant, Ka, of a hydrogen atom present on a molecule. A molecule has a distinct pK for each hydrogen atom that can be deprotonated. The acidity of a specific hydrogen atom in a molecule is represented by the pK value. Continue Reading."
817,5177316,"EVD in humans is caused by four of five viruses of the genus Ebolavirus. The four are Bundibugyo virus (BDBV), Sudan virus (SUDV), Taï Forest virus (TAFV) and one simply called Ebola virus (EBOV, formerly Zaire Ebola virus)."
818,8438730,"The Postal Service will issue the first stamp, which celebrates the year of the rabbit in the Lunar new year, on Jan. 22 under the new policy. 0:00 / 1:43 One investment that grows forever. The first Forever Stamp featured the Liberty Bell and was issued in April 2007. Since then, 28 billion Forever Stamps have been sold, generating more than $12 billion in revenue. 1  Print. 2  Email."
819,7171570,"Knowing what to wear to a wedding can be challenging, especially for those who don’t know the bride and groom well, but many invitations will include clues to proper attire — in this case, cocktail attire. Cocktail attire conjures up different styles for many people, but here are a few hints from fashion experts on what to wear for a cocktail-style wedding. Women: A cocktail dress just around knee-length is always best. Make sure its a well-fitted garment, nothing that sags or hangs off the body. Sagging or loose-fitting dresses often have a more casual tone unfitting of cocktail attire."
820,8438838,"Urdu Translation, Definition and Meaning of English Word Khadija. Words matching your search are: khadija, For English to Urdu sentence translation please visit: English to Urdu translation. Khadija Meaning, Pap Meaning, Pacific Meaning, Argent Meaning, Atif hassan Meaning, Tuft Meaning, Roundlet Meaning, Footnote Meaning,"
821,803610,"Gorgeous Gunlocke suites available this August. Boasting a 9'x9'x6' footprint, in a chestnut/oak veneer, these suites come with plenty of storage with a full on credenza. Each suite also includes two guest chairs, wall mounted hutch, tack board, slat wall and a Human Scale Keyboard."
822,717182,"A capsid is the protein shell of a virus. It consists of several oligomeric structural subunits made of protein called protomers.The observable 3-dimensional morphological subunits, which may or may not correspond to individual proteins, are called capsomeres.The capsid encloses the genetic material of the virus.irus capsid T-numbers. Icosahedral virus capsids are typically assigned a triangulation number (T-number) to describe the relation between the number of pentagons and hexagons i.e. their quasi-symmetry in the capsid shell."
823,7172078,"Lyle, it is confusing but operating margin is different from profit margin. Operating margin is what a company makes on each dollar of sales before interest and taxes. Profit margin is net income divided by revenue. So, Wal-Mart’s operating margin is ~5.7% as you state, but its profit margin is ~3.37%."
824,7172079,"If the average person could realize that a 36% profit margin isn’t even close to reality, and that the typical, median firm has a profit margin of only 6.5%, or almost 30 percentage points below what the public thinks is a normal profit margin, then hopefully the average person would become a little more realistic about how the business world operates."
825,7172112,FDA-Approved Products for Treating Opioid Addiction and Overdose. 1  FDA has approved a number of drug products that address opioid addiction or overdose. Methadone and buprenorphine products are part of the class of extended-release and long-acting (ER/LA) opioids and are approved for the treatment of opioid addiction.
826,7172145,"These specialists are often referred to as “behavioral health consultants”, working hand in hand with family doctors to help address issues with a behavioral component. When more traditional services are needed, they are referred to a “specialty mental health provider”. Regardless of the terms, the field of mental health is slowly moving to incorporate a medical and social perspective. Conversely, the field of medicine is also adopting a more social and medical viewpoint of most disorders."
827,5178263,CAST Test Preparation. Looking for a reliable CAST test study guide and CAST practice tests? Start preparing with JobTestPrep today. We are the only resource that provides online practice materials for all sections of EEI's CAST test. Our materials follow the same concepts and question styles seen on the real test. Learn how we can help you improve your performance on test day.
828,5178268,"The CAST test can be scored both by machine and by hand. Scores from the four CAST aptitude test are combined into a single index score, ranging from 1 - 10 (10 being the highest). A candidate's index score reflects the expected probability of a successful job performance. Prepare for CAST. JobTestPrep's CAST practice pack includes all sections of the CAST."
829,5178368,1 the process of determining the value of a function between two points at which it has prescribed values.  a similar process using more than two points at which the function has prescribed values.
830,7172709,1920s Vintage Tenne Hats Purple Lilac Woven Straw Lavender Flower Flapper Cloche. Vintage Art Deco Red Velvet Gold Lame Lamé Lame Soutache Trim Flapper Cloche. Hat Vintage Ruched Cornflower Blue Gray Velvet Silver Lame Lamé Leaf Trim Toque. Cloche Hat Vintage Art Deco Taupe Silk Colorful Crewel Chain Stitch Flapper. cloche hat
831,7172882,"crore - the number that is represented as a one followed by 7 zeros; ten million Bharat, India, Republic of India - a republic in the Asian subcontinent in southern Asia; second most populous country in the world; achieved independence from the United Kingdom in 1947"
832,8036532,"Schnecksville, PA Weather. Schnecksville, PA climate is warm during summer when temperatures tend to be in the 70's and very cold during winter when temperatures tend to be in the 20's."
833,717305,"THE HAPLOID-DIPLOID LIFE CYCLE. The haploid-diploid life cycle is the most complex life cycle and thus has lots of variation. It is also the most common life cycle among plants since all land plants, the vascular plants and the bryophytes, are haploid-diploid. An alternation of generations defines the haploid-diploid, or 1n-2n, life cycle."
834,7173250,cytology definition: The definition of cytology is a branch of biology that studies the structure and function of plant and animal cells. (noun) When a biologist studies how human blood cells work and how they relate to each other and to the rest of the...
835,8036630,"Calories, Fat, Protein, Fiber, & Carbs In Mcdonalds Sausage Mcgriddle; Calories, Fat, Protein, Fiber, & Carbs In Sausage Mcgriddle; Calories, Fat, Protein, Fiber, & Carbs In Eat N Park Stuffed Pepper Soup; Calories, Fat, Protein, Fiber, & Carbs In Eat N Park Wedding Soup; 2200 Calorie Vegetarian Weight Loss Meal Plan"
836,5178438,The name Carlos is a French baby name. In French the meaning of the name Carlos is: Strong. American Meaning: The name Carlos is an American baby name. In American the meaning of the name Carlos is: Strong.Spanish Meaning: The name Carlos is a Spanish baby name.In Spanish the meaning of the name Carlos is: Manly.n American the meaning of the name Carlos is: Strong. Spanish Meaning: The name Carlos is a Spanish baby name. In Spanish the meaning of the name Carlos is: Manly.
837,8439267,"We've only had dual-band routers until now, operating on the 2.4GHz and 5GHz band. The Nighthawk X6 offers a 2.4GHz band and two 5GHz bands. These dual 5GHz bands act as performance load balancers."
838,8439268,"More WiFi for More Devices. There's never been WiFi like it. The Nighthawk X6 AC3200 Router with breakthrough Tri-Band WiFi technology was built to connect to each and every device in your home—automatically and simultaneously. Laptops, tablets, phones, TVs, game consoles, music streamers, cameras – if it’s WiFi enabled, it’s X6 accelerated."
839,8439269,"The Nighthawk X6, with Tri-Band WiFi is the gamers choice for best in class WiFi with the latest AC3200 speed and performance. Powerful dual core 1GHz processor and three offload processors provide total WiFi speeds up to 3.2Gbps."
840,8439330,"1 Identification of the virus can be best made from stool specimens taken within 48 to 72 hours after onset of symptoms, although good results can be obtained by using RT-PCR on samples taken as long as 5 days after symptom onset. 2  Virus can sometimes be found in stool samples taken as late as 2 weeks after recovery."
841,7173821,"Check GEORGIAS OWN CREDIT UNION routing numbers for bank transfers. 261071577 is a routing number of GEORGIAS OWN CREDIT UNION. Check detailed information about 261071577. This bank routing number is required for electronic funds transfer. Bank routing number of GEORGIAS OWN CREDIT UNION is the first nine digits of the number along the bottom left section of your check. The routing number for checking, savings and money market accounts identifies the financial institution where the account was opened and is located."
842,7173882,Deontay Wilder Net Worth Deontay Wilder’s net worth can be accounted to $12 Million. There are innumerable reasons for his increased net worth but the ultimate reason is his boxing.
843,7173954,"The hydrocarbon dew point is the temperature (at a given pressure) at which the hydrocarbon components of any hydrocarbon-rich gas mixture, such as natural gas, will start to condense out of the gaseous phase. It is often also referred to as the HDP or the HCDP."
844,5178787,"With one or more of the words Any one, but not necessarily all of the words you enter here will appear in the search results. Any one, but not necessarily all of the words you enter here will appear in the search results."
845,717407,"In fact, the arctic wolf is the only sub-species of wolf that is not threatened. Physical Description. Arctic wolves are smaller than grey wolves, They also have smaller ears and shorter muzzles to retain body heat. Size."
846,7174098,Share it with your friends/family. 1  Difference Between USB 1.0 and USB 2.0. 2  Difference Between USB and Firewire. 3  Difference Between Crossover Cable and Ethernet Cable. 4  Difference Between WiFi and Bluetooth. 5  Difference Between Ethernet and T1. 6  Difference Between RJ45 and CAT5. 7  Difference Between Bluetooth and Wireless.
