462,8420600,"1 In analysing the parts of a metaphor, tenor has another meaning, unrelated to the meaning above. 2  According to I. A. Richards, the two parts of a metaphor are the tenor and vehicle. 3  The tenor is the subject to which attributes are ascribed."
463,8420601,"1 According to I. A. Richards, the two parts of a metaphor are the tenor and vehicle. 2  The tenor is the subject to which attributes are ascribed. 3  The vehicle is the subject from which the attributes are derived. 4  Thus, they are broadly equivalent to the notions of target and source domains in conceptual metaphor theory."
464,8022070,"Lunch Menu: Mon-Fri | 11AM-3PM Dinner Menu: Sun-Wed 4-10PM, Thu-Sat Until 11PM Brunch Menu: Sat-Sun | 11AM-3PM Late Night Bar Menu: Sun-Wed 10-12AM, Thurs-Sat Until 1AM"
465,8022093,"The Benefits of Training. The benefits of having a trained dog are nearly limitless! From the moment you get your new puppy or dog, here’s a run-down of just some of the advantages and benefits: Puppy classes provide the opportunity for getting your new family member started off right."
466,8022107,"Heart Heart (Hebrew lebab/leb , Gk. kardia ) occurs over one thousand times in the Bible, making it the most common anthropological term in the Scripture. It denotes a person's center for both physical and emotional-intellectual-moral activities; sometimes it is used figuratively for any inaccessible thing."
467,8420610,"But I don't think they will be lifetime.My guess is lifetime stays as base platinum as it is with Starwood currently ( not breaking any promises that way) . This is a great way for Marriott to incent people to stay after they are lifetime to get higher tier benefits , SUITE Upgrade certs for instance."
468,8420638,"1 Singapore: Anyone who even attempts suicide can be sent to prison for up to a full year. 2  South Africa: Attempting or committing suicide is not considered a crime in this country. 3  From 1886 to 1968 it was illegal, but this legislation no longer stands."
469,5165621,"The Nadi International Airport is the main airport in Fiji, and most of the visitors to the archipelago land in this airport. A number of international flights come to the airport at Nadi. It also has domestic flights for taking travelers to other important locations in Fiji. Flights come to the Nadi airport from major cities in the world like Auckland, London, Los Angeles, Tokyo, Sydney, Melbourne, Brisbane, Vancouver and New York. Flights also come from locations like Honolulu, Tahiti, Samoa, Tonga and Seoul. Air Transportation Fiji."
470,5165750,"At the end of its life-cycle the phoenix builds itself a nest of cinnamon twigs that it then ignites; both nest and bird burn fiercely and are reduced to ashes, from which a new, young phoenix arises. The new phoenix is destined to live, usually, as long as the old one."
471,8420908,"One factor behind the divergence in the two versions of Korean was the North's decision to purify the language by eliminating the many words of Chinese origin and coining new native terms to replace them. In South Korea, Sino-Korean words still comprise more than half of the vocabulary."
472,842091,"USPS raises price of stamps. The U.S. Postal service is now charging Americans a penny more for stamps and postcard mailings. The price of a first-class stamp for domestic mail rose Sunday from 45 cents to 46 cents, while postcards cost 33 cents to send. The USPS rolled out the pricing changes alongside a new stamp – the Global Forever – which lets people mail one-ounce letters to anywhere in the world for $1.10."
473,802247,"This keeps the bow of the boat down, and also stops the boat sliding aft on the trailer. Try to eliminate movement, as this leads to wear. Pad straps and tie down lines, so they do not wear into the boat. Anything in the boat that could move or bang, should be tied off and/or padded."
474,8022481,"In biology, a species is the basic unit of classification and a taxonomic rank, as well as a unit of biodiversity, but it has proven difficult to find a satisfactory definition. Scientists and conservationists need a species definition which allows them to"
475,8022486,"Organism definition, a form of life composed of mutually interdependent parts that maintain various vital processes. See more."
476,842095,There are two ways to tell if the timing belt has been replaced. One is obvious-you are looking at a service receipt showing the replacement. the other way would be to remove the first timing belt cover (the one closest to the radiator) . It has about 6 10mm size bolts that hold it on.
477,802254,"The definition of microeconomics is the study of how all of the elements in an economy function together. An example of microeconomics is the study of consumer behavior. a branch of economics dealing with certain specific factors affecting an economy, as the behavior of individual consumers, the marketing of particular products, etc."
478,842097,There are two ways to tell if the timing belt has been replaced. One is obvious-you are looking at a service receipt showing the replacement. the other way would be to remove the first timing belt cover (the one closest to the radiator) .
479,842099,"Re: Is there a way to tell if my timing belt has been changed? Good; I never thought to ask this, probably next weekend I'll pull my t-belt covers and check the manufacture date, an dprobably run out hysterically looking for a t-belt."
480,842100,There are two ways to tell if the timing belt has been replaced. One is obvious-you are looking at a service receipt showing the replacement.
481,7153349,"Switzerland, Franc. The Swiss Franc is the currency of Switzerland. Our currency rankings show that the most popular Switzerland Franc exchange rate is the CHF to EUR rate. The currency code for Francs is CHF, and the currency symbol is CHF. Below, you'll find Swiss Franc rates and a currency converter. You can also subscribe to our currency newsletters with daily rates and analysis, read the XE Currency Blog, or take CHF rates on the go with our XE Currency Apps and website."
482,5166197,"No. Amoxicillin will work against some types of bacterial infections, but not chlamydia or gonorrhea (usually). The usual treatment for gonorrhea these days is an injection of ceftriaxone, and chlamydia is usually treated with an antibiotic called azithromycin or sometimes doxycycline."
483,7153750,"In database relational modeling and implementation, a unique key (a redundant term since a key, by definition, implies attribute(s) value(s) uniqueness, therefore it should be avoided) is a superkey—that is, in the relational model of database organization, a set of attributes of a relation variable for which it holds that in all relations assigned ..."
484,5166554,the most common cause is usually food born bacteria that cause food spoilage or some bacterial endospores (= inactive forms of bacteria ) that germinate in the human intestine … and cause disease What type of front is most likely cause severe weather?
485,516664,"Banger at breakfast, but negver mash-it will be bangers and mash for dinner! Breakfast-bangers, bacon, baked beans, fried egg, rashers of b acon, NOT a slab of thick stuff. Fried tomato, fried bread (I know it's gross, but I'm telling you what they have in the north!), mushrooms (fried), and two pieces of toast. This is a typical fried English breakfast."
486,5166798,"Social workers help individuals, families and communities with everything from physical and mental health difficulties to social and financial issues, such as acquiring welfare, social security or other types of funding."
487,7154102,Rank correlation is a measure of the relationship between the rankings of two variables or two rankings of the same variable: Spearman's rank correlation coefficient is a measure of how well the relationship between two variables can be described by a monotonic function.
488,5167198,"(Redirected from Lake County IL) Lake County is a county in the northeastern corner of the U.S. state of Illinois. According to the 2010 census, it has a population of 703,462, making it the third-most populous county in Illinois. Its county seat is Waukegan."
489,7154420,"Lemon and cinnamon has individual benefits. The combination of lime and cinnamon gives relief to ailments ranging from clearing acne to immunity disorders. Mix 2 tsp of cinnamon powder, a tsp of honey and a little lime juice in a cup of water. Drinking this before breakfast combats arthritis and joint pains. Vitamin C in lemon helps strengthen the immune system and reduces infections while cinnamon kills bacteria."
490,7154484,"brain functions. There is a test that can help show whether there is a loss of dopamine transporters in the brain. Along with other clinical tests, this imaging test can help your doctor determine whether the symptoms are the result of a parkinsonian syndrome (PS) or essential tremor (ET). DaTscan is an imaging drug that will be injected into the bloodstream to help your doctor assess dopamine transporters, which help recycle dopamine, a chemical involved in controlling movement."
491,8421845,"An Excel spreadsheet can be programmed to convert time values into integers for use in tasks like calculating payroll, determining labor costs and evaluating productivity rates. Typically, an IF function formula is used to convert the values and differentiate between regular and overtime hours.n Excel spreadsheet can be programmed to convert time values into integers for use in tasks like calculating payroll, determining labor costs and evaluating productivity rates. Typically, an IF function formula is used to convert the values and differentiate between regular and overtime hours."
492,7154569,"Scaling and root planing, also known as conventional periodontal therapy, non-surgical periodontal therapy, or deep cleaning, is a procedure involving removal of dental plaque and calculus (scaling or debridement) and then smoothing, or planing, of the (exposed) surfaces of the roots, removing cementum or dentine that is impregnated with calculus, ..."
493,8422003,"R&B singer Johnny Kemp found dead on beach. Bahamian R&B singer Johnny Kemp, who is best known for the hit song Just Got Paid, has died in Jamaica. He was 55. Jamaica police said Friday that Kemp was found floating at a beach in Montego Bay on Thursday morning. It had not yet been determined how he died."
494,8422365,"From your comments, I gather that your concern is not with her faith, but with her anxiety and depression. There are already lots of answers here about how to challenge faith, and also answers on why it's probably not a great idea in a relationship. I won't belabor those points. But what I'm going to tell you is to seek therapy for her. I know quite a few devout believers of all stripes, includin..."
495,8422378,"up vote 6 down vote. Cinnamon is from the bark of a tree, and nutmeg is a seed. Cinnamon is the hot flavor in a lot of candies, e.g. Hot Tamales, as well as being used in apple pie and cinnamon rolls. Nutmeg is more subtle, often used with other spices, sometimes including cinnamon.Beyond this, let your taste buds decide.innamon is from the bark of a tree, and nutmeg is a seed. Cinnamon is the hot flavor in a lot of candies, e.g. Hot Tamales, as well as being used in apple pie and cinnamon rolls."
496,8422757,"Relating resistance to temperature. The resistance of an RTD changes almost linearly with temperature. Often, widely available tables are used for converting temperature to resistance and vice versa. (In fact, we include tables you can use for the two most commonly used RTD temperature coefficients. See the Excel file below.)"
497,7155110,U.S. Army Military District of Washington (MDW) U.S. Army Test and Evaluation Command (ATEC) United States Military Academy (USMA) U.S. Army Reserve Command (USARC) U.S. Army Acquisition Support Center (USAASC) U.S. Army Installation Management Command (IMCOM)
498,7155139,"1 You only need to count net carbs because these are what significantly impact your blood sugar level.  Foods which are low in net carbs don’t have a major impact on your blood sugar level, and as such are less likely to disrupt your weight loss."
499,7155151,"Talk to AWS today and the FCAW process is defined by either using gas or no gas. If a welder is certifed for FCAW, he is then qualified for self shield or Dual shield. However he must have the correct WPS stating either self or dual shield."
500,8422864,"The HSS Orthopedic Trauma Service has conducted many studies. Please see our publications on shoulder fractures, humerus fractures, and use of locking plates in fracture treatment."
501,7155336,"Two years earlier, runoff from a gold mine near Dadong contaminated the water supply for more than 200,000 people. Over the years, similar disasters have occurred in Spain, Peru, the Philippines, and elsewhere, and there are plenty of other sites in China that scientists have their eye on."
502,7155384,FAI Form 1: Part Number Accountability Posted by Michael Kolesar on 05 September 2016 05:48 PM This form is used to identify the inspected part and its associated sub-assemblies or detail FAIs. Part Number: Number of the part. Part Name: Name of the part as shown on the drawing. Serial Number: Serial number of the part; provide only if the part is serialized. FAI Report Number: Reference number that identifies the FAIR.
503,8423289,"Fracture blisters. These are a relatively uncommon complication of fractures (2.9% of fractures admitted to hospital in one series) in areas where skin adheres tightly to bone with little intervening soft tissue cushioning. Examples include the ankle, wrist, elbow and foot."
504,8022794,Best Wedding Venues of 2017; Best Wedding Venues of 2016; Outdoor Wedding Venues Rustic Wedding Venues
505,8423299,"Ruins recently discovered in southern Peru could be the ancient lost city of Paititi, according to claims that are drawing serious but cautious response from experts."
506,8423300,"But there are also many other ruins in Peru that are just as exciting and they offer visitors an incredible glimpse into the incredible history of Peru. One such set of ruins are the Huaca Pucllana ruins, located in Miraflores, a suburb of Lima. The ruins at this site were originally constructed by the Lima culture."
507,8022912,"If an inverse function exists for a given function f, then it is unique. This follows since the inverse function must be the inverse relation which is completely determined by f. Symmetry. There is a symmetry between a function and its inverse."
508,8022957,"Throughout the millennia, the meanings ascribed to Celtic knots have prevailed. Their longevity is largely explained by the strong connection between the visual design elements and symbolic meaning, as is shown below in Celtic Knot Meanings. One meaning above all has prevailed. The interlacing, continuous design is the symbol of the interconnectedness and continuity of life."
509,8022979,See also. 1  2005 Lake Tanganyika earthquake. 2  2008 Lake Kivu earthquake. 3  East African Plateau. 4  Great Lakes refugee crisis. 5  List of lakes. 6  List of lakes by area. 7  Rift Valley lakes.
510,8423649,"Has anyone ran true dual exhaust on their 07 or 08 silverado? Just wondering if it would cause any problems or make performance worse than a single in, dual out setup. I had true duals on my 02 silverado and it actually made a big difference performance wise. Sounded alot better than the single in dual out setup I had on it before."
511,802327,"Lenoir County, NC Houses for Sale. Buying a home in Lenoir County, North Carolina doesn't have to be difficult - Homes.com makes home buying a breeze. With 440 homes for sale in Lenoir County, North Carolina, you can search by price, bedrooms, neighborhood, and even by property type. Search Lenoir County homes for sale, foreclosures, MLS listings, and more. Make an informed decision with Lenoir County school data, neighborhood information, find Lenoir County real estate agents, and research home values in Lenoir County, NC. Homes.com has everything you need but the house keys."
512,8023285,"vital capacity VC; the volume of gas that can be expelled from the lungs from a position of full inspiration, with no limit to duration of inspiration; equal to inspiratory capacity plus expiratory reserve volume.Spirometry (meaning the measuring of breath) is the most common of the pulmonary function tests (PFTs), measuring lung function, specifically the amount (volume) and/or speed (flow) of air that can be inhaled and exhaled."
513,8424030,"According to these guidelines, the mainstays of the treatment of sepsis include: 1  Controlling the source of the infection; 2  Antimicrobial therapy; 3  Resuscitation and hemodynamic support;  Organ support, including mechanical ventilation and renal replacement 1  therapy; Sedation/analgesia as needed; 2  and. Adequate nutrition."
514,8424139,"When HITEC is used in an open system, in contact with the air, and in the higher operating range between 350 and 1000°F (454-. 538°C), the nitrite is slowly oxidized by atmospheric oxygen: Because of the high heat transfer coefficients and high heat. capacity of HITEC, equipment size and surface areas for heat."
515,8424220,"Answer You can, but that is not very healty for you and once you start to eat normal again, you will gain the weight back very fast. I am trying to los … e weight right now. I have found out that in order to lose 1 lb a week you have to cut out 500 calories a day."
516,7156386,"The ancient Greeks honored a wide variety of gods, and many are still worshiped today by Hellenic Pagans. Learn about some of the best known gods and goddesses of the Greek pantheon. Gods of the Ancient Greeks"
517,7156443,"Suppliers / Durable Medical Equipment & Medical Supplies is the primary health care specialty. Apria Healthcare Inc can be contacted via phone (325) 677-2405, or through Starck, Daniel via phone (949) 639-2000. Suppliers / Durable Medical Equipment & Medical Supplies A supplier of medical equipment such as respirators, wheelchairs, home dialysis systems, or monitoring systems, that are prescribed by a physician for a patient’s use in the home and that are usable for an extended period of time."
518,7156445,"Apria Healthcare, Inc. practices as a Durable Medical Equipment & Medical Supplier provider in Sikeston, Missouri. Find their office location, ratings, phone number, NPI, and more."
519,7156446,"About APRIA HEALTHCARE LLC. Apria Healthcare Llc is a provider in Irvine, CA. The NPI number assigned to this provider is 1457462459. The practitioner's primary taxonomy code is Durable Medical Equipment & Medical Supplies (332B00000X). The provider is registered as an organization and their NPI record was last updated 5 years ago."
520,715676,"1 Size of the Floor-Typically, the larger the floor area, the lower the cost per square foot for installation due to the economies of scale. 2  A small residential floor project, for example, is likely to cost more per square foot than a large 50,000-square-foot commercial floor.ideo on the cost of concrete floors. Depending on the level of complexity, concrete floors can cost as little as $2 to $6 a square foot or be as expensive as $15 to $30 a square foot."
521,7156811,"Civil Engineering Drafting and Design Airports, bridges, sewer systems and water plants all have one thing in common - they started out on the drawing board of a civil engineering drafter. Read on to learn more about this field's education and career options. Inside Civil Engineering Drafting and Design. Civil engineering is a profession that dates back thousands of years. Civil engineers design and supervise the construction of the infrastructure that is essential to daily life. Aiding the civil engineer in this job are the technologists who use drafting and design tools to bring the engineer's ideas to fruition."
522,7156846,Civil law synonyms and Civil law antonyms. Top synonym for civil law (another word for civil law) is Roman law.
523,8424876,"Step 3. Open your encryption program and select the option to create a new volume. Each encryption program will show you a list of all devices connected to your computer, so select the drive that corresponds with your external hard drive.The volume needs to be created on this device.or example, if your external hard drive is F:/ you will want to create a new volume on your F drive. If you are asked what type of volume to make, select any non-system partition option since your external hard drive is not part of your computer."
524,8425082,"Shellsburg, Iowa is located a short distance west of Cedar Rapids in Benton County. 261 people like this and 260 people follow this."
525,8425252,"In classical mechanics, impulse is the integral of a force, F, over the time interval, t, for which it acts. Since force is a vector quantity, impulse is also a vector in the same direction. Impulse applied to an object produces an equivalent vector change in its linear momentum, also in the same direction. The SI unit of impulse is the newton second, and the dimensionally equivalent unit of momentum is the kilogram meter per second. The corresponding English engineering units are the pound-seco"
526,5167527,2012 GMC Acadia Fuel Injector COST Does anyone have a cost estimate to replace 1 fuel injector vs 6 of them in a 2012 GMC Acadia? I got a quote from the GMC dealer of $1100 for 1 vs $2000 for all 6. Besides the fuel injector are there additional things that should be replaced as part of that process?
527,8023290,What is the meaning of the word forestall? What is the meaning of the word forestal? What is the meaning of the word forestage? What is the meaning of the word forestaff? What is the meaning of the word forest? What is the meaning of the word forespin? What is the meaning of the word forestaller? What is the meaning of the word forestalling? What is the meaning of the word forestalls? What is the meaning of the word forestand? What is the meaning of the word forestation? What is the meaning of the word forestay?
528,8425766,"So unless a urine sample is being sent in to a lab specifically for mass spectrometer analysis, it is very unlikely that tramadol will cause a positive result. Smeg said: ↑ SWIM informs me that the only thing that will show up in a drug test for opiates will be just opiates which can be ascribed to (over the counter) medicines which merely have only a small amount of codeine in them. He is not aware of any test that can specifically identify tramadol."
529,8425928,"SECTION II: RATES, FEES AND PAYMENT INFORMATION. LOWE’S CREDIT CARD ACCOUNT AGREEMENT. How Interest is Calculated. Your Interest Rate We use a daily rate to calculate the interest on the balance on your account each day. The daily rate for purchases is the APR times 1/365. The daily rate for purchases is .07395% (APR 26.99%)."
530,5167799,"Temperature. The hottest day of 2013 was June 30, with a high temperature of 116°F. For reference, on that day the average high temperature is 103°F and the high temperature exceeds 109°F only one day in ten. The hottest month of 2013 was July with an average daily high temperature of 104°F."
531,802352,"Lasagne originated in Italy, traditionally ascribed to the city of Naples (Campania), where the first modern recipe was created and published in Liber de Coquina (The Book of Cookery), and became a traditional dish.s with most other types of pasta, the Italian word is a plural form, lasagne meaning more than one sheet of lasagna, though in many other languages a derivative of the singular word lasagna is used for the popular dish."
532,8023570,"Commission’s decision, within the meaning of section 27-9-101. Mr. Hall did not appeal the ruling. Mr. McFarland, who, again, did not participate in the public hearing in any capacity, also did not attempt to seek judicial review of the Election Commission’s determination."
533,8023759,"The cast for the packed DC Universe movie will have their hands full, as the film sees Amanda Waller's secret team Task Force X (consisting of Deadshot, Bronze Tiger, Killer Frost, Captain Boomerang, Harley Quinn and Copperhead) sent to retrieve a powerful mystical object that they will risk their lives to steal."
534,8023951,"The cost of birth control: By the numbers The Week Staff The cost of the pill ranges widely: Generic varieties can cost $9 per month, while brand-name versions can top $90 per month."
535,8024101,"One of those is The Quad, a new series about the trials and tribulations of the students and faculty of Georgia A&M, a fictional… 'The Quad' Cast Is Going To Bring A Provocative New Look At HBCU Life"
536,8024102,You've probably seen at least one of the projects that Ruben Santiago-Hudson has been a part of prior to joining The Quad cast. He has appeared in everything from Law & Order to Devil's Advocate to American Gangster to Castle to Selma to Billions.
537,8024103,"After seeing this short sneak peek of the series, what immediately grabbed me was the complexity of each of the characters, and I think you can thank the exceptional cast of The Quad for that. Perhaps the reason why it seems like the cast of The Quad will be so successful is because it kind of has a little bit of everything. You have your veteran actors and your ingenues, your TV stars and your stage thespians. You've even got people who are musically inclined."
538,8024199,User: The slowest type of mass movement is known as A. a slump. B. creep. C. a mudslide. D. a rockfall. Weegy: The slowest type of mass movement is known as Creep. Expert answered|Score 1|lovefallen|Points 1093| User: What process causes dissolved substances to be left behind to form minerals after water in lakes or ponds evaporates? A.
